Physical Drive SMART information attached to RAID Controller 0

Device Id                      : 2
Slot Number                    : 3
Interface Type                 : SATA
SMART Attributes Data Revision Number: 1
Vender Specific SMART Attributes with Thresholds:
ID# ATTRIBUTE_NAME                  FLAG     VALUE WORST THRESHOLD TYPE      UPDATED  WHEN_FAILED RAW_VALUE
  1 Raw_Read_Error_Rate             0x0002   100   100   000       Old_age   Always       -       0
  5 Reallocated_Sectors_Count       0x0002   100   100   000       Old_age   Always       -       0
  9 Power_On_Hours                  0x0002   100   100   000       Old_age   Always       -       19992
 12 Power_Cycle_Count               0x0002   100   100   000       Old_age   Always       -       3
160 Unknown_Attribute               0x0002   100   100   000       Old_age   Always       -       0
161 Unknown_Attribute               0x0002   100   100   000       Old_age   Always       -       243
163 Unknown_Attribute               0x0000   100   100   000       Old_age   Offline      -       9
164 Unknown_Attribute               0x0002   100   100   000       Old_age   Always       -       193761
165 Unknown_Attribute               0x0002   100   100   000       Old_age   Always       -       232
166 Unknown_Attribute               0x0002   100   100   000       Old_age   Always       -       130
167 Unknown_Attribute               0x0002   100   100   000       Old_age   Always       -       199
168 Unknown_Attribute               0x0003   100   100   060       Pre-fail  Always       -       0
170 Reserved_Block_Count            0x0002   100   100   000       Old_age   Always       -       0
177 Wear_Leveling_Count             0x0002   100   100   000       Old_age   Always       -       408
181 Program_Fail_Count_Total        0x0002   100   100   000       Old_age   Always       -       0
182 Erase_Fail_Count_Total          0x0002   100   100   000       Old_age   Always       -       0
192 Power-Off_Retract_Count         0x0002   100   100   000       Old_age   Always       -       2
194 Temperature_Celsius             0x0002   100   100   060       Old_age   Always       -       29 (Lifetime Min/Max 18/42)
195 Hardware_ECC_Recovered          0x0002   100   100   000       Old_age   Always       -       151031
197 Current_Pending_Sector          0x0002   100   100   000       Old_age   Always       -       0
198 Offline_Uncorrectable           0x0002   100   100   000       Old_age   Always       -       0
199 UltraDMA_CRC_Error_Count        0x0002   100   100   000       Old_age   Always       -       0
231 Drive_Temperature               0x0003   097   100   001       Pre-fail  Always       -       97
232 Avaliable_Reserved_Space        0x0003   100   100   060       Pre-fail  Always       -       100
241 Total_LBAS_Written              0x0002   100   100   000       Old_age   Always       -       4900052
242 Total_LBAS_Read                 0x0002   100   100   000       Old_age   Always       -       2104382
245 SanDisk_SSD_Lifetim_Remain      0x0002   100   100   000       Old_age   Always       -       7847392
250 Read_Error_Retry_Rate           0x0002   100   100   000       Old_age   Always       -       108
252 Unknown_Attribute               0x0002   100   100   000       Old_age   Always       -       0
200 Multi-Zone_Error_Rate           0x0003   100   100   060       Pre-fail  Always       -       5068061868047



Device Id                      : 3
Slot Number                    : 2
Interface Type                 : SATA
SMART Attributes Data Revision Number: 1
Vender Specific SMART Attributes with Thresholds:
ID# ATTRIBUTE_NAME                  FLAG     VALUE WORST THRESHOLD TYPE      UPDATED  WHEN_FAILED RAW_VALUE
  1 Raw_Read_Error_Rate             0x0002   100   100   000       Old_age   Always       -       0
  5 Reallocated_Sectors_Count       0x0002   100   100   000       Old_age   Always       -       0
  9 Power_On_Hours                  0x0002   100   100   000       Old_age   Always       -       19934
 12 Power_Cycle_Count               0x0002   100   100   000       Old_age   Always       -       3
160 Unknown_Attribute               0x0002   100   100   000       Old_age   Always       -       0
161 Unknown_Attribute               0x0002   100   100   000       Old_age   Always       -       238
163 Unknown_Attribute               0x0000   100   100   000       Old_age   Offline      -       13
164 Unknown_Attribute               0x0002   100   100   000       Old_age   Always       -       199378
165 Unknown_Attribute               0x0002   100   100   000       Old_age   Always       -       239
166 Unknown_Attribute               0x0002   100   100   000       Old_age   Always       -       137
167 Unknown_Attribute               0x0002   100   100   000       Old_age   Always       -       206
168 Unknown_Attribute               0x0003   100   100   060       Pre-fail  Always       -       0
170 Reserved_Block_Count            0x0002   100   100   000       Old_age   Always       -       0
177 Wear_Leveling_Count             0x0002   100   100   000       Old_age   Always       -       480
181 Program_Fail_Count_Total        0x0002   100   100   000       Old_age   Always       -       0
182 Erase_Fail_Count_Total          0x0002   100   100   000       Old_age   Always       -       0
192 Power-Off_Retract_Count         0x0002   100   100   000       Old_age   Always       -       2
194 Temperature_Celsius             0x0002   100   100   060       Old_age   Always       -       29 (Lifetime Min/Max 21/46)
195 Hardware_ECC_Recovered          0x0002   100   100   000       Old_age   Always       -       66387
197 Current_Pending_Sector          0x0002   100   100   000       Old_age   Always       -       0
198 Offline_Uncorrectable           0x0002   100   100   000       Old_age   Always       -       0
199 UltraDMA_CRC_Error_Count        0x0002   100   100   000       Old_age   Always       -       0
231 Drive_Temperature               0x0003   096   100   001       Pre-fail  Always       -       96
232 Avaliable_Reserved_Space        0x0003   100   100   060       Pre-fail  Always       -       100
241 Total_LBAS_Written              0x0002   100   100   000       Old_age   Always       -       4900530
242 Total_LBAS_Read                 0x0002   100   100   000       Old_age   Always       -       2104881
245 SanDisk_SSD_Lifetim_Remain      0x0002   100   100   000       Old_age   Always       -       8074851
250 Read_Error_Retry_Rate           0x0002   100   100   000       Old_age   Always       -       110
252 Unknown_Attribute               0x0002   100   100   000       Old_age   Always       -       0
200 Multi-Zone_Error_Rate           0x0003   100   100   060       Pre-fail  Always       -       4904853110799



Device Id                      : 4
Slot Number                    : 5
Interface Type                 : SATA
SMART Attributes Data Revision Number: 10
Vender Specific SMART Attributes with Thresholds:
ID# ATTRIBUTE_NAME                  FLAG     VALUE WORST THRESHOLD TYPE      UPDATED  WHEN_FAILED RAW_VALUE
  1 Raw_Read_Error_Rate             0x000f   080   064   044       Pre-fail  Always       -       92752158
  3 Spin_Up_Time                    0x0003   095   095   000       Pre-fail  Always       -       0
  4 Start_Stop_Count                0x0032   100   100   020       Old_age   Always       -       5
  5 Reallocated_Sectors_Count       0x0033   100   100   010       Pre-fail  Always       -       0
  7 Seek_Error_Rate                 0x000f   086   060   045       Pre-fail  Always       -       445796775
  9 Power_On_Hours                  0x0032   081   081   000       Old_age   Always       -       16661
 10 Spin_Retry_Count                0x0013   100   100   097       Pre-fail  Always       -       0
 12 Power_Cycle_Count               0x0032   100   100   020       Old_age   Always       -       2
 18 Unknown_Attribute               0x000b   100   100   050       Pre-fail  Always       -       0
187 Reported_Uncorrectable_Error    0x0032   100   100   000       Old_age   Always       -       0
188 Command_Timeout                 0x0032   100   099   000       Old_age   Always       -       1
190 Airflow_Temperature_Celsius     0x0022   076   048   040       Old_age   Always       -       24 (Lifetime Min/Max 19/38)
192 Power-Off_Retract_Count         0x0032   100   100   000       Old_age   Always       -       2
193 Load_Cycle_Count                0x0032   100   100   000       Old_age   Always       -       1028
194 Temperature_Celsius             0x0022   024   040   000       Old_age   Always       -       24 (0 19 0 0)
195 Hardware_ECC_Recovered          0x001a   032   001   000       Old_age   Always       -       92752158
197 Current_Pending_Sector          0x0012   100   100   000       Old_age   Always       -       0
198 Offline_Uncorrectable           0x0010   100   100   000       Old_age   Offline      -       0
199 UltraDMA_CRC_Error_Count        0x003e   200   200   000       Old_age   Always       -       0
240 Head_Flying_Hours               0x0000   100   253   000       Old_age   Offline      -       93613107200127
241 Total_LBAS_Written              0x0000   100   253   000       Old_age   Offline      -       1199495193876
242 Total_LBAS_Read                 0x0000   100   253   000       Old_age   Offline      -       2080720423216



Device Id                      : 5
Slot Number                    : 4
Interface Type                 : SATA
SMART Attributes Data Revision Number: 10
Vender Specific SMART Attributes with Thresholds:
ID# ATTRIBUTE_NAME                  FLAG     VALUE WORST THRESHOLD TYPE      UPDATED  WHEN_FAILED RAW_VALUE
  1 Raw_Read_Error_Rate             0x000f   081   064   044       Pre-fail  Always       -       125291183
  3 Spin_Up_Time                    0x0003   095   095   000       Pre-fail  Always       -       0
  4 Start_Stop_Count                0x0032   100   100   020       Old_age   Always       -       5
  5 Reallocated_Sectors_Count       0x0033   100   100   010       Pre-fail  Always       -       0
  7 Seek_Error_Rate                 0x000f   087   060   045       Pre-fail  Always       -       465332394
  9 Power_On_Hours                  0x0032   081   081   000       Old_age   Always       -       16662
 10 Spin_Retry_Count                0x0013   100   100   097       Pre-fail  Always       -       0
 12 Power_Cycle_Count               0x0032   100   100   020       Old_age   Always       -       2
 18 Unknown_Attribute               0x000b   100   100   050       Pre-fail  Always       -       0
187 Reported_Uncorrectable_Error    0x0032   100   100   000       Old_age   Always       -       0
188 Command_Timeout                 0x0032   100   100   000       Old_age   Always       -       0
190 Airflow_Temperature_Celsius     0x0022   077   063   040       Old_age   Always       -       23 (Lifetime Min/Max 18/37)
192 Power-Off_Retract_Count         0x0032   100   100   000       Old_age   Always       -       2
193 Load_Cycle_Count                0x0032   100   100   000       Old_age   Always       -       1024
194 Temperature_Celsius             0x0022   023   040   000       Old_age   Always       -       23 (0 18 0 0)
195 Hardware_ECC_Recovered          0x001a   032   001   000       Old_age   Always       -       125291183
197 Current_Pending_Sector          0x0012   100   100   000       Old_age   Always       -       0
198 Offline_Uncorrectable           0x0010   100   100   000       Old_age   Offline      -       0
199 UltraDMA_CRC_Error_Count        0x003e   200   200   000       Old_age   Always       -       0
240 Head_Flying_Hours               0x0000   100   253   000       Old_age   Offline      -       92711164067969
241 Total_LBAS_Written              0x0000   100   253   000       Old_age   Offline      -       1199495043581
242 Total_LBAS_Read                 0x0000   100   253   000       Old_age   Offline      -       2080085086069



Device Id                      : 6
Slot Number                    : 7
Interface Type                 : SATA
SMART Attributes Data Revision Number: 10
Vender Specific SMART Attributes with Thresholds:
ID# ATTRIBUTE_NAME                  FLAG     VALUE WORST THRESHOLD TYPE      UPDATED  WHEN_FAILED RAW_VALUE
  1 Raw_Read_Error_Rate             0x000f   076   064   044       Pre-fail  Always       -       41391954
  3 Spin_Up_Time                    0x0003   094   094   000       Pre-fail  Always       -       0
  4 Start_Stop_Count                0x0032   100   100   020       Old_age   Always       -       6
  5 Reallocated_Sectors_Count       0x0033   100   100   010       Pre-fail  Always       -       0
  7 Seek_Error_Rate                 0x000f   086   060   045       Pre-fail  Always       -       356230717
  9 Power_On_Hours                  0x0032   081   081   000       Old_age   Always       -       16662
 10 Spin_Retry_Count                0x0013   100   100   097       Pre-fail  Always       -       0
 12 Power_Cycle_Count               0x0032   100   100   020       Old_age   Always       -       2
 18 Unknown_Attribute               0x000b   100   100   050       Pre-fail  Always       -       0
187 Reported_Uncorrectable_Error    0x0032   100   100   000       Old_age   Always       -       0
188 Command_Timeout                 0x0032   100   099   000       Old_age   Always       -       1
190 Airflow_Temperature_Celsius     0x0022   077   063   040       Old_age   Always       -       23 (Lifetime Min/Max 19/34)
192 Power-Off_Retract_Count         0x0032   100   100   000       Old_age   Always       -       3
193 Load_Cycle_Count                0x0032   100   100   000       Old_age   Always       -       1030
194 Temperature_Celsius             0x0022   023   040   000       Old_age   Always       -       23 (0 17 0 0)
195 Hardware_ECC_Recovered          0x001a   036   001   000       Old_age   Always       -       41391954
197 Current_Pending_Sector          0x0012   100   100   000       Old_age   Always       -       0
198 Offline_Uncorrectable           0x0010   100   100   000       Old_age   Offline      -       0
199 UltraDMA_CRC_Error_Count        0x003e   200   200   000       Old_age   Always       -       0
240 Head_Flying_Hours               0x0000   100   253   000       Old_age   Offline      -       213524299137151
241 Total_LBAS_Written              0x0000   100   253   000       Old_age   Offline      -       1200446891567
242 Total_LBAS_Read                 0x0000   100   253   000       Old_age   Offline      -       2082554263223



Device Id                      : 7
Slot Number                    : 6
Interface Type                 : SATA
SMART Attributes Data Revision Number: 10
Vender Specific SMART Attributes with Thresholds:
ID# ATTRIBUTE_NAME                  FLAG     VALUE WORST THRESHOLD TYPE      UPDATED  WHEN_FAILED RAW_VALUE
  1 Raw_Read_Error_Rate             0x000f   078   064   044       Pre-fail  Always       -       57363160
  3 Spin_Up_Time                    0x0003   095   095   000       Pre-fail  Always       -       0
  4 Start_Stop_Count                0x0032   100   100   020       Old_age   Always       -       5
  5 Reallocated_Sectors_Count       0x0033   100   100   010       Pre-fail  Always       -       0
  7 Seek_Error_Rate                 0x000f   086   060   045       Pre-fail  Always       -       394505775
  9 Power_On_Hours                  0x0032   081   081   000       Old_age   Always       -       16662
 10 Spin_Retry_Count                0x0013   100   100   097       Pre-fail  Always       -       0
 12 Power_Cycle_Count               0x0032   100   100   020       Old_age   Always       -       2
 18 Unknown_Attribute               0x000b   100   100   050       Pre-fail  Always       -       0
187 Reported_Uncorrectable_Error    0x0032   100   100   000       Old_age   Always       -       0
188 Command_Timeout                 0x0032   100   099   000       Old_age   Always       -       1
190 Airflow_Temperature_Celsius     0x0022   077   063   040       Old_age   Always       -       23 (Lifetime Min/Max 18/37)
192 Power-Off_Retract_Count         0x0032   100   100   000       Old_age   Always       -       2
193 Load_Cycle_Count                0x0032   100   100   000       Old_age   Always       -       1026
194 Temperature_Celsius             0x0022   023   040   000       Old_age   Always       -       23 (0 18 0 0)
195 Hardware_ECC_Recovered          0x001a   034   001   000       Old_age   Always       -       57363160
197 Current_Pending_Sector          0x0012   100   100   000       Old_age   Always       -       0
198 Offline_Uncorrectable           0x0010   100   100   000       Old_age   Offline      -       0
199 UltraDMA_CRC_Error_Count        0x003e   200   200   000       Old_age   Always       -       0
240 Head_Flying_Hours               0x0000   100   253   000       Old_age   Offline      -       157681134354559
241 Total_LBAS_Written              0x0000   100   253   000       Old_age   Offline      -       1200438885901
242 Total_LBAS_Read                 0x0000   100   253   000       Old_age   Offline      -       2078222369619



Device Id                      : 8
Slot Number                    : 9
Interface Type                 : SATA
SMART Attributes Data Revision Number: 1
Vender Specific SMART Attributes with Thresholds:
ID# ATTRIBUTE_NAME                  FLAG     VALUE WORST THRESHOLD TYPE      UPDATED  WHEN_FAILED RAW_VALUE
  1 Raw_Read_Error_Rate             0x0002   100   100   000       Old_age   Always       -       0
  5 Reallocated_Sectors_Count       0x0002   100   100   000       Old_age   Always       -       0
  9 Power_On_Hours                  0x0002   100   100   000       Old_age   Always       -       12330
 12 Power_Cycle_Count               0x0002   100   100   000       Old_age   Always       -       7
160 Unknown_Attribute               0x0002   100   100   000       Old_age   Always       -       0
161 Unknown_Attribute               0x0002   100   100   000       Old_age   Always       -       511
163 Unknown_Attribute               0x0000   100   100   000       Old_age   Offline      -       12
164 Unknown_Attribute               0x0002   100   100   000       Old_age   Always       -       194455
165 Unknown_Attribute               0x0002   100   100   000       Old_age   Always       -       155
166 Unknown_Attribute               0x0002   100   100   000       Old_age   Always       -       55
167 Unknown_Attribute               0x0002   100   100   000       Old_age   Always       -       98
168 Unknown_Attribute               0x0003   100   100   060       Pre-fail  Always       -       0
170 Reserved_Block_Count            0x0002   100   100   000       Old_age   Always       -       0
177 Wear_Leveling_Count             0x0002   100   100   000       Old_age   Always       -       19
181 Program_Fail_Count_Total        0x0002   100   100   000       Old_age   Always       -       0
182 Erase_Fail_Count_Total          0x0002   100   100   000       Old_age   Always       -       0
192 Power-Off_Retract_Count         0x0002   100   100   000       Old_age   Always       -       5
194 Temperature_Celsius             0x0002   100   100   060       Old_age   Always       -       28 (Lifetime Min/Max 20/57)
195 Hardware_ECC_Recovered          0x0002   100   100   000       Old_age   Always       -       335111
197 Current_Pending_Sector          0x0002   100   100   000       Old_age   Always       -       0
198 Offline_Uncorrectable           0x0002   100   100   000       Old_age   Always       -       0
199 UltraDMA_CRC_Error_Count        0x0002   100   100   000       Old_age   Always       -       0
231 Drive_Temperature               0x0003   099   100   001       Pre-fail  Always       -       99
232 Avaliable_Reserved_Space        0x0003   100   100   060       Pre-fail  Always       -       100
241 Total_LBAS_Written              0x0002   100   100   000       Old_age   Always       -       3224283
242 Total_LBAS_Read                 0x0002   100   100   000       Old_age   Always       -       8537614
245 SanDisk_SSD_Lifetim_Remain      0x0002   100   100   000       Old_age   Always       -       7875423
250 Read_Error_Retry_Rate           0x0002   100   100   000       Old_age   Always       -       84
252 Unknown_Attribute               0x0002   100   100   000       Old_age   Always       -       0
200 Multi-Zone_Error_Rate           0x0003   100   100   060       Pre-fail  Always       -       4986457489423



Device Id                      : 9
Slot Number                    : 10
Interface Type                 : SATA
SMART Attributes Data Revision Number: 1
Vender Specific SMART Attributes with Thresholds:
ID# ATTRIBUTE_NAME                  FLAG     VALUE WORST THRESHOLD TYPE      UPDATED  WHEN_FAILED RAW_VALUE
  1 Raw_Read_Error_Rate             0x0002   100   100   000       Old_age   Always       -       0
  5 Reallocated_Sectors_Count       0x0002   100   100   000       Old_age   Always       -       0
  9 Power_On_Hours                  0x0002   100   100   000       Old_age   Always       -       12418
 12 Power_Cycle_Count               0x0002   100   100   000       Old_age   Always       -       7
160 Unknown_Attribute               0x0002   100   100   000       Old_age   Always       -       0
161 Unknown_Attribute               0x0002   100   100   000       Old_age   Always       -       501
163 Unknown_Attribute               0x0000   100   100   000       Old_age   Offline      -       22
164 Unknown_Attribute               0x0002   100   100   000       Old_age   Always       -       206960
165 Unknown_Attribute               0x0002   100   100   000       Old_age   Always       -       172
166 Unknown_Attribute               0x0002   100   100   000       Old_age   Always       -       70
167 Unknown_Attribute               0x0002   100   100   000       Old_age   Always       -       105
168 Unknown_Attribute               0x0003   100   100   060       Pre-fail  Always       -       0
170 Reserved_Block_Count            0x0002   100   100   000       Old_age   Always       -       0
177 Wear_Leveling_Count             0x0002   100   100   000       Old_age   Always       -       34
181 Program_Fail_Count_Total        0x0002   100   100   000       Old_age   Always       -       0
182 Erase_Fail_Count_Total          0x0002   100   100   000       Old_age   Always       -       0
192 Power-Off_Retract_Count         0x0002   100   100   000       Old_age   Always       -       5
194 Temperature_Celsius             0x0002   100   100   060       Old_age   Always       -       29 (Lifetime Min/Max 21/57)
195 Hardware_ECC_Recovered          0x0002   100   100   000       Old_age   Always       -       513273
197 Current_Pending_Sector          0x0002   100   100   000       Old_age   Always       -       0
198 Offline_Uncorrectable           0x0002   100   100   000       Old_age   Always       -       0
199 UltraDMA_CRC_Error_Count        0x0002   100   100   000       Old_age   Always       -       0
231 Drive_Temperature               0x0003   098   100   001       Pre-fail  Always       -       98
232 Avaliable_Reserved_Space        0x0003   100   100   060       Pre-fail  Always       -       100
241 Total_LBAS_Written              0x0002   100   100   000       Old_age   Always       -       3268385
242 Total_LBAS_Read                 0x0002   100   100   000       Old_age   Always       -       8537952
245 SanDisk_SSD_Lifetim_Remain      0x0002   100   100   000       Old_age   Always       -       8381856
250 Read_Error_Retry_Rate           0x0002   100   100   000       Old_age   Always       -       86
252 Unknown_Attribute               0x0002   100   100   000       Old_age   Always       -       0
200 Multi-Zone_Error_Rate           0x0003   100   100   060       Pre-fail  Always       -       4904853110799



Device Id                      : 10
Slot Number                    : 8
Interface Type                 : SATA
SMART Attributes Data Revision Number: 1
Vender Specific SMART Attributes with Thresholds:
ID# ATTRIBUTE_NAME                  FLAG     VALUE WORST THRESHOLD TYPE      UPDATED  WHEN_FAILED RAW_VALUE
  1 Raw_Read_Error_Rate             0x0002   100   100   000       Old_age   Always       -       0
  5 Reallocated_Sectors_Count       0x0002   100   100   000       Old_age   Always       -       0
  9 Power_On_Hours                  0x0002   100   100   000       Old_age   Always       -       12391
 12 Power_Cycle_Count               0x0002   100   100   000       Old_age   Always       -       8
160 Unknown_Attribute               0x0002   100   100   000       Old_age   Always       -       0
161 Unknown_Attribute               0x0002   100   100   000       Old_age   Always       -       504
163 Unknown_Attribute               0x0000   100   100   000       Old_age   Offline      -       19
164 Unknown_Attribute               0x0002   100   100   000       Old_age   Always       -       46632
165 Unknown_Attribute               0x0002   100   100   000       Old_age   Always       -       65
166 Unknown_Attribute               0x0002   100   100   000       Old_age   Always       -       6
167 Unknown_Attribute               0x0002   100   100   000       Old_age   Always       -       23
168 Unknown_Attribute               0x0003   100   100   060       Pre-fail  Always       -       0
170 Reserved_Block_Count            0x0002   100   100   000       Old_age   Always       -       0
177 Wear_Leveling_Count             0x0002   100   100   000       Old_age   Always       -       0
181 Program_Fail_Count_Total        0x0002   100   100   000       Old_age   Always       -       0
182 Erase_Fail_Count_Total          0x0002   100   100   000       Old_age   Always       -       0
192 Power-Off_Retract_Count         0x0002   100   100   000       Old_age   Always       -       6
194 Temperature_Celsius             0x0002   100   100   060       Old_age   Always       -       29 (Lifetime Min/Max 21/57)
195 Hardware_ECC_Recovered          0x0002   100   100   000       Old_age   Always       -       300294
197 Current_Pending_Sector          0x0002   100   100   000       Old_age   Always       -       0
198 Offline_Uncorrectable           0x0002   100   100   000       Old_age   Always       -       0
199 UltraDMA_CRC_Error_Count        0x0002   100   100   000       Old_age   Always       -       0
231 Drive_Temperature               0x0003   100   100   001       Pre-fail  Always       -       100
232 Avaliable_Reserved_Space        0x0003   100   100   060       Pre-fail  Always       -       100
241 Total_LBAS_Written              0x0002   100   100   000       Old_age   Always       -       1572047
242 Total_LBAS_Read                 0x0002   100   100   000       Old_age   Always       -       1665442
245 SanDisk_SSD_Lifetim_Remain      0x0002   100   100   000       Old_age   Always       -       1888558
250 Read_Error_Retry_Rate           0x0002   100   100   000       Old_age   Always       -       85
252 Unknown_Attribute               0x0002   100   100   000       Old_age   Always       -       0
200 Multi-Zone_Error_Rate           0x0003   100   100   060       Pre-fail  Always       -       4904853110799



Device Id                      : 11
Slot Number                    : 1
Interface Type                 : SATA
SMART Attributes Data Revision Number: 1
Vender Specific SMART Attributes with Thresholds:
ID# ATTRIBUTE_NAME                  FLAG     VALUE WORST THRESHOLD TYPE      UPDATED  WHEN_FAILED RAW_VALUE
  1 Raw_Read_Error_Rate             0x0002   100   100   000       Old_age   Always       -       0
  5 Reallocated_Sectors_Count       0x0002   100   100   000       Old_age   Always       -       0
  9 Power_On_Hours                  0x0002   100   100   000       Old_age   Always       -       152
 12 Power_Cycle_Count               0x0002   100   100   000       Old_age   Always       -       7
160 Unknown_Attribute               0x0002   100   100   000       Old_age   Always       -       0
161 Unknown_Attribute               0x0002   100   100   000       Old_age   Always       -       302
163 Unknown_Attribute               0x0000   100   100   000       Old_age   Offline      -       6
164 Unknown_Attribute               0x0002   100   100   000       Old_age   Always       -       31012
165 Unknown_Attribute               0x0002   100   100   000       Old_age   Always       -       81
166 Unknown_Attribute               0x0002   100   100   000       Old_age   Always       -       2
167 Unknown_Attribute               0x0002   100   100   000       Old_age   Always       -       31
168 Unknown_Attribute               0x0003   100   100   060       Pre-fail  Always       -       0
170 Reserved_Block_Count            0x0002   100   100   000       Old_age   Always       -       0
177 Wear_Leveling_Count             0x0002   100   100   000       Old_age   Always       -       0
181 Program_Fail_Count_Total        0x0002   100   100   000       Old_age   Always       -       0
182 Erase_Fail_Count_Total          0x0002   100   100   000       Old_age   Always       -       0
192 Power-Off_Retract_Count         0x0002   100   100   000       Old_age   Always       -       4
194 Temperature_Celsius             0x0002   100   100   060       Old_age   Always       -       28 (Lifetime Min/Max 24/61)
195 Hardware_ECC_Recovered          0x0002   100   100   000       Old_age   Always       -       1298
197 Current_Pending_Sector          0x0002   100   100   000       Old_age   Always       -       0
198 Offline_Uncorrectable           0x0002   100   100   000       Old_age   Always       -       0
199 UltraDMA_CRC_Error_Count        0x0002   100   100   000       Old_age   Always       -       0
231 Drive_Temperature               0x0003   100   100   001       Pre-fail  Always       -       100
232 Avaliable_Reserved_Space        0x0003   100   100   060       Pre-fail  Always       -       100
241 Total_LBAS_Written              0x0002   100   100   000       Old_age   Always       -       376491
242 Total_LBAS_Read                 0x0002   100   100   000       Old_age   Always       -       42542
245 SanDisk_SSD_Lifetim_Remain      0x0002   100   100   000       Old_age   Always       -       675912
250 Read_Error_Retry_Rate           0x0002   100   100   000       Old_age   Always       -       11
252 Unknown_Attribute               0x0002   100   100   000       Old_age   Always       -       0
200 Multi-Zone_Error_Rate           0x0003   100   100   060       Pre-fail  Always       -       5317169971215



Device Id                      : 12
Slot Number                    : 0
Interface Type                 : SATA
SMART Attributes Data Revision Number: 1
Vender Specific SMART Attributes with Thresholds:
ID# ATTRIBUTE_NAME                  FLAG     VALUE WORST THRESHOLD TYPE      UPDATED  WHEN_FAILED RAW_VALUE
  1 Raw_Read_Error_Rate             0x0002   100   100   000       Old_age   Always       -       0
  5 Reallocated_Sectors_Count       0x0002   100   100   000       Old_age   Always       -       0
  9 Power_On_Hours                  0x0002   100   100   000       Old_age   Always       -       170
 12 Power_Cycle_Count               0x0002   100   100   000       Old_age   Always       -       9
160 Unknown_Attribute               0x0002   100   100   000       Old_age   Always       -       0
161 Unknown_Attribute               0x0002   100   100   000       Old_age   Always       -       297
163 Unknown_Attribute               0x0000   100   100   000       Old_age   Offline      -       10
164 Unknown_Attribute               0x0002   100   100   000       Old_age   Always       -       30911
165 Unknown_Attribute               0x0002   100   100   000       Old_age   Always       -       83
166 Unknown_Attribute               0x0002   100   100   000       Old_age   Always       -       1
167 Unknown_Attribute               0x0002   100   100   000       Old_age   Always       -       31
168 Unknown_Attribute               0x0003   100   100   060       Pre-fail  Always       -       0
170 Reserved_Block_Count            0x0002   100   100   000       Old_age   Always       -       0
177 Wear_Leveling_Count             0x0002   100   100   000       Old_age   Always       -       0
181 Program_Fail_Count_Total        0x0002   100   100   000       Old_age   Always       -       0
182 Erase_Fail_Count_Total          0x0002   100   100   000       Old_age   Always       -       0
192 Power-Off_Retract_Count         0x0002   100   100   000       Old_age   Always       -       4
194 Temperature_Celsius             0x0002   100   100   060       Old_age   Always       -       28 (Lifetime Min/Max 24/66)
195 Hardware_ECC_Recovered          0x0002   100   100   000       Old_age   Always       -       465
197 Current_Pending_Sector          0x0002   100   100   000       Old_age   Always       -       0
198 Offline_Uncorrectable           0x0002   100   100   000       Old_age   Always       -       0
199 UltraDMA_CRC_Error_Count        0x0002   100   100   000       Old_age   Always       -       0
231 Drive_Temperature               0x0003   100   100   001       Pre-fail  Always       -       100
232 Avaliable_Reserved_Space        0x0003   100   100   060       Pre-fail  Always       -       100
241 Total_LBAS_Written              0x0002   100   100   000       Old_age   Always       -       380395
242 Total_LBAS_Read                 0x0002   100   100   000       Old_age   Always       -       31878
245 SanDisk_SSD_Lifetim_Remain      0x0002   100   100   000       Old_age   Always       -       673753
250 Read_Error_Retry_Rate           0x0002   100   100   000       Old_age   Always       -       12
252 Unknown_Attribute               0x0002   100   100   000       Old_age   Always       -       0
200 Multi-Zone_Error_Rate           0x0003   100   100   060       Pre-fail  Always       -       5480378728463



